{
  "compatibility": {
    "cube_get_capabilities_scope": "legacy_P2_printer_only",
    "legacy_adapter_card_tools": [
      "cube_get_capabilities",
      "cube_prepare_print",
      "cube_check_print",
      "cube_render_svg"
    ],
    "legacy_adapter_card_version": "P3-MCP-LOCAL/0.1.1",
    "no_changes_to_p0_p1_p2": true,
    "prefer_this_tool_for_whole_cube_discovery": true
  },
  "cross_domain": {
    "canonical_admission": "NOT_EVALUATED",
    "current_authority": "NOT_EVALUATED",
    "epistemic_warrant": "NOT_EVALUATED",
    "overall_status": "NOT_DEFINED",
    "p0_to_p1": "NO_AUTOMATIC_REFERENCE_BINDING",
    "p1_to_p2": "NO_AUTOMATIC_ACG_TO_VP03_MAPPING"
  },
  "deployment": {
    "filesystem_side_effects_from_mcp_tools": false,
    "http_api_available": false,
    "local_mcp_available": true,
    "no_host_authentication_claim": true,
    "remote_mcp_available": false,
    "webmcp_available": false
  },
  "domains": {
    "P0": {
      "interface": "MCP Resources primary, one allowlisted paged Tool fallback",
      "reference_version": "v9.4",
      "resource_count": 14,
      "role": "canonical_documentary_reference",
      "snapshot_lock_sha256": "cb259c5962a61c507ace6260d37ae364cf6658794a115052e3bc4fefdca477a1",
      "source_reference_count": 13,
      "source_warrant": "canonical_documentary_reference_only",
      "tools": [
        "cube_read_reference"
      ],
      "truth_evaluated": false,
      "validation_performed": false
    },
    "P1": {
      "admission": "NOT_EVALUATED",
      "authority": "NOT_EVALUATED",
      "checks": [
        "syntax",
        "structure",
        "concept_resolution",
        "referent_binding",
        "predicate_typing",
        "method_typing",
        "qualifier_typing",
        "scope_consistency"
      ],
      "configuration_error_is_mcp_error": true,
      "core_profile": "P1-VC/1.0.0",
      "role": "descriptive_validation_only",
      "semantic_failure_is_mcp_error": false,
      "source_truth": "NOT_EVALUATED",
      "statuses": [
        "PASS",
        "FAIL",
        "UNRESOLVED"
      ],
      "tools": [
        "cube_validate"
      ]
    },
    "P2": {
      "automatic_acg_to_svg_mapping": false,
      "automatic_multi_svg": false,
      "core_profile": "P2-VP/1.0.0-rc1",
      "granularity": [
        "overview",
        "standard",
        "detail"
      ],
      "lenses": [
        "cube.lens.semantics",
        "cube.lens.provenance",
        "cube.lens.execution",
        "cube.lens.governance",
        "cube.lens.epistemology"
      ],
      "p1_validation_included": false,
      "role": "presentation_projection_only",
      "source_warrant": "declared_unverified",
      "tools": [
        "cube_get_capabilities",
        "cube_prepare_print",
        "cube_check_print",
        "cube_render_svg"
      ],
      "views": [
        "cube.flow",
        "cube.diagramm",
        "cube.tree"
      ]
    }
  },
  "format": "aiaeao.cube.mcp-capability-surface/1",
  "mcp": {
    "fallback_when_host_hides_resources": "cube_read_reference",
    "host_resource_visibility": "host_dependent_unverified",
    "official_python_sdk_major": 2,
    "protocol_target": "2026-07-28",
    "resource_uris": [
      "https://cube.lunados.net/manifest.json",
      "https://cube.lunados.net/v9.4/core.json",
      "https://cube.lunados.net/v9.4/grammar/concepts.json",
      "https://cube.lunados.net/v9.4/grammar/constraints.json",
      "https://cube.lunados.net/v9.4/grammar/relations.json",
      "https://cube.lunados.net/v9.4/morphology.md",
      "https://cube.lunados.net/v9.4/notation/ast.schema.json",
      "https://cube.lunados.net/v9.4/notation/grammar.ebnf",
      "https://cube.lunados.net/v9.4/notation/syntax.json",
      "https://cube.lunados.net/v9.4/observer.json",
      "https://cube.lunados.net/v9.4/time.json",
      "https://cube.lunados.net/v9.4/visual/README.md",
      "https://cube.lunados.net/v9.4/visual/symbols.json",
      "aiaeao://p0/resources/v1"
    ],
    "tools": [
      "cube_get_capabilities",
      "cube_prepare_print",
      "cube_check_print",
      "cube_render_svg",
      "cube_read_reference",
      "cube_validate",
      "cube_discover_surface"
    ],
    "transport": "stdio"
  },
  "release": {
    "architecture": "ADR-001/ACCEPTED;CP-001/G0-G3/ACCEPTED",
    "name": "aiaeao-cube-local",
    "reference_version": "v9.4",
    "status": "release_candidate",
    "version": "P3-MCP-LOCAL/0.2.0-rc1"
  }
}
